<?xml version="1.0" encoding="iso-8859-1"?>
<!-- DSC Dsc Export 2010 09 16 -->
<root
      xmlns:xsi="http://www.w3.org/2001/XMLSchema-instance"
      xsi:noNamespaceSchemaLocation="schema/missionpacker.xsd"
      >
	<mission>
		<name>Mission01</name>
		<sequenceArray>
			<sequence>
				<name>foo</name>
				<key>
					<time>0.0</time>
					<dataPlayAnimation>
						<actorName>foo</actorName>
						<animationName>bar</animationName>
						<rate>0.99</rate>
						<fadeTime>0.1566</fadeTime>
						<startTime>0.0</startTime>
					</dataPlayAnimation>
				</key>
				<key>
					<time>0.0</time>
					<dataAnimateClientTrigger>
						<clientTrigger>aa</clientTrigger>
						<data>bb</data>
						<lerpDuration>0.01</lerpDuration>
						<lerpType>TLinear</lerpType>
					</dataAnimateClientTrigger>
				</key>
				<key>
					<time>0.0</time>
					<dataAnimateClientTriggerFloat>
						<clientTrigger>aa</clientTrigger>
						<data>vv</data>
						<value>0.1</value>
						<lerpDuration>0.02</lerpDuration>
						<lerpType>TLinear</lerpType>
					</dataAnimateClientTriggerFloat>
				</key>
				<key>
					<time>0.0</time>
					<dataAnimateClientTriggerString>
						<clientTrigger>a</clientTrigger>
						<data>v</data>
						<value>c</value>
						<lerpDuration>0.01</lerpDuration>
						<lerpType>TLinear</lerpType>
					</dataAnimateClientTriggerString>
				</key>
				<key>
					<time>0.0</time>
					<dataAnimateClientTriggerVector>
						<clientTrigger>a</clientTrigger>
						<data>c</data>
						<valueX>-5.69379</valueX>
						<valueY>0.0</valueY>
						<valueZ>-72.8905</valueZ>
						<lerpDuration>0.01</lerpDuration>
						<lerpType>TEaseInOut</lerpType>
					</dataAnimateClientTriggerVector>
				</key>
				<key>
					<time>0.0</time>
					<dataAnimateClientTriggerVectorVector>
						<clientTrigger>a</clientTrigger>
						<data>c</data>
						<valueOneX>0.0</valueOneX>
						<valueOneY>0.0</valueOneY>
						<valueOneZ>1.0</valueOneZ>
						<valueTwoX>0.0</valueTwoX>
						<valueTwoY>1.0</valueTwoY>
						<valueTwoZ>0.0</valueTwoZ>
						<lerpDuration>0.01</lerpDuration>
						<lerpType>TEaseInOut</lerpType>
					</dataAnimateClientTriggerVectorVector>
				</key>
				<key>
					<time>0.0</time>
					<dataClientTrigger>
						<clientTrigger>s</clientTrigger>
						<data>f</data>
					</dataClientTrigger>
				</key>
				<key>
					<time>0.0</time>
					<dataClientTriggerFloat>
						<clientTrigger>a</clientTrigger>
						<data>d</data>
						<value>0.1</value>
					</dataClientTriggerFloat>
				</key>
				<key>
					<time>0.02</time>
					<dataClientTriggerString>
						<clientTrigger>a</clientTrigger>
						<data>s</data>
						<value>d</value>
					</dataClientTriggerString>
				</key>
				<key>
					<time>0.0</time>
					<dataClientTriggerVector>
						<clientTrigger>a</clientTrigger>
						<data>d</data>
						<valueX>6.13202</valueX>
						<valueY>0.0</valueY>
						<valueZ>-73.3063</valueZ>
					</dataClientTriggerVector>
				</key>
				<key>
					<time>0.0</time>
					<dataClientTriggerVectorVector>
						<clientTrigger>a</clientTrigger>
						<data>c</data>
						<valueOneX>0.0</valueOneX>
						<valueOneY>0.0</valueOneY>
						<valueOneZ>1.0</valueOneZ>
						<valueTwoX>0.0</valueTwoX>
						<valueTwoY>1.0</valueTwoY>
						<valueTwoZ>0.0</valueTwoZ>
					</dataClientTriggerVectorVector>
				</key>
				<key>
					<time>0.5</time>
					<dataLoopSequence>
						<gotoTime>0.01</gotoTime>
					</dataLoopSequence>
				</key>
				<key>
					<time>10.0</time>
					<nop/>
				</key>
			</sequence>
		</sequenceArray>
	</mission>
</root>
